{
  "day": "Tuesday",
  "owner": "Student 2",
  "lectures": [
    {
      "time": "10:00",
      "roomNumber": 202,
      "titleLecture": "Linux Basics"
    },
    {
      "time": "10:00",
      "roomNumber": 202,
      "titleLecture": "Permissions"
    },
    {
      "time": "10:00",
      "roomNumber": 202,
      "titleLecture": "Bash Practice"
    }
  ],
  "status": "Scheduled",
  "labStatus": {
    "timeChange": {
      "status": "fixed",
      "note": "Times set to 10:00"
    },
    "jsonRecovery": {
      "status": "fixed",
      "note": "Trailing comma removed"
    },
    "schemaRecovery": {
      "status": "in_progress",
      "note": "Integration team is updating Monday room validation requirements."
    }
  }
}