{
  "day": "Wednesday",
  "owner": "Student 3",
  "lectures": [
    {
      "time": "10:00",
      "roomNumber": 203,
      "titleLecture": "Docker Intro"
    },
    {
      "time": "10:00",
      "roomNumber": 203,
      "titleLecture": "Containers"
    },
    {
      "time": "10:00",
      "roomNumber": 203,
      "titleLecture": "Compose Basics"
    }
  ],
  "status": "Scheduled",
  "labStatus": {
    "timeChange": {
      "status": "fixed",
      "note": "Times set to 10:00"
    },
    "jsonRecovery": {
      "status": "fixed",
      "note": "Trailing comma removed"
    },
    "schemaRecovery": {
      "status": "fixed",
      "note": "Room number fixed"
    }
  }
}