{
  "day": "Saturday",
  "owner": "Student 6",
  "lectures": [
    {
      "time": "10:00",
      "roomNumber": 206,
      "titleLecture": "IaC Intro"
    },
    {
      "time": "10:00",
      "roomNumber": 206,
      "titleLecture": "CloudFormation"
    },
    {
      "time": "10:00",
      "roomNumber": 206,
      "titleLecture": "Terraform Basics"
    }
  ],
  "status": "Scheduled",
  "labStatus": {
    "timeChange": {
      "status": "pending",
      "note": "Waiting for Day 1"
    },
    "jsonRecovery": {
      "status": "pending",
      "note": "Waiting for Day 2"
    },
    "schemaRecovery": {
      "status": "pending",
      "note": "Waiting for Day 3"
    }
  }
}